{
  "schemaVersion": 1,
  "claim": "ai-user-testing-mcp v2: governed catalog (1,849 entries, 580 exact-SHA gitlinks), sandboxed runner with provision + runner-owned app-server lifecycle + baseline-scoped evidence harvest, 24 reviewed adapters, CLI + MCP, six-harness install receipts; TransformFit web lane executed end-to-end — 5/5 scenarios reached terminal success states with genuine cypress evidence (73/73 registry screens rendered), remaining lanes stay in honest blocked/queued/failed states (credential/toolchain/device gates); private remote equals local HEAD",
  "repoCommit": "d122149d41d34de71617ec1f672c189c8b757302",
  "catalogHash": "7ad7910b6b99b7d7d4fec2907c406c029ebcad271963e7629c1874dd3523e6bf",
  "sourcePinHash": "d98891c5233281fd7d2c475daf44f1af7cecc99025402d2fdac2935309c2c1a1",
  "tests": [
    {
      "name": "workspace tests",
      "command": "pnpm exec vitest run",
      "exitCode": 0,
      "summary": "      Tests  232 passed (232) |    Start at  17:46:30 |    Duration  2.71s (transform 8.80s, setup 0ms, import 12.12s, tests 5.47s, environment 1ms)"
    },
    {
      "name": "workspace build",
      "command": "pnpm -r build",
      "exitCode": 0,
      "summary": "apps/mcp-server build$ tsc -p tsconfig.json | packages/cli build: Done | apps/mcp-server build: Done"
    },
    {
      "name": "pins gate",
      "command": "node scripts/verify-pins.mjs",
      "exitCode": 0,
      "summary": "pins↔gitlinks EQUAL across 580 sources"
    },
    {
      "name": "doctor",
      "command": "./node_modules/.bin/tsx packages/cli/src/main.ts doctor",
      "exitCode": 0,
      "summary": "PASS [blocking] adapters-dir: 24 valid descriptors | PASS [blocking] sandbox-writable: /Users/rig128gb/Developer/ai-user-testing-mcp/.rig-testlab/sandbox writable | INFO [info]     credentials: GH_TOKEN=present GITHUB_TOKEN=present RIG_TESTLAB_PROMPTFOO_TOKEN=absent RIG_TESTLAB_TESTMU_SMARTUI_TOKEN="
    }
  ],
  "agentInstallReceipts": [
    {
      "harness": "claude",
      "receiptPath": "/Users/rig128gb/.rig-installer/receipts/ai-user-testing/1.0.0/claude/receipt.json",
      "sha256": "1e676fd9a54c1b2725ba220ae1ab433abe80fef115c1d13e3cf37999d358d97c"
    },
    {
      "harness": "codex",
      "receiptPath": "/Users/rig128gb/.rig-installer/receipts/ai-user-testing/1.0.0/codex/receipt.json",
      "sha256": "22ed49e278d57d5e935f253d034f1477426f49245e15ec4f9220c6cc2b3f6d05"
    },
    {
      "harness": "hermes",
      "receiptPath": "/Users/rig128gb/.rig-installer/receipts/ai-user-testing/1.0.0/hermes/receipt.json",
      "sha256": "e235dbe47761577b48bdee09309ac25cec3832cf0d4f1f68789e394d2a910872"
    },
    {
      "harness": "omp",
      "receiptPath": "/Users/rig128gb/.rig-installer/receipts/ai-user-testing/1.0.0/omp/receipt.json",
      "sha256": "c8481292cf058db999a730e527305d806dbbae917442d8d04e15729c0422e261"
    },
    {
      "harness": "orca",
      "receiptPath": "/Users/rig128gb/.rig-installer/receipts/ai-user-testing/1.0.0/orca/receipt.json",
      "sha256": "c5d8f0e6511648d1d34e1425f261a1b1c77aba83be21447d99faa8c4337d354c"
    },
    {
      "harness": "prime",
      "receiptPath": "/Users/rig128gb/.rig-installer/receipts/ai-user-testing/1.0.0/prime/receipt.json",
      "sha256": "70bdf94fbc28731b70a7570b0a5c4ab1ba7090c79e7fcd3c86846e61c6debdfd"
    }
  ],
  "transformfitSmoke": {
    "compiled": true,
    "representativeRuns": [
      {
        "platform": "persona-evals",
        "runId": "tf-ai-persona-evals-1",
        "state": "blocked"
      },
      {
        "platform": "coach-contract",
        "runId": "tf-api-coach-contract-1",
        "state": "failed"
      },
      {
        "platform": "boundary-inputs",
        "runId": "tf-data-boundary-inputs-1",
        "state": "failed"
      },
      {
        "platform": "sim-smoke",
        "runId": "tf-ios-sim-smoke-1",
        "state": "failed"
      },
      {
        "platform": "week-sim",
        "runId": "tf-long-week-sim-1",
        "state": "passed"
      },
      {
        "platform": "baseline-scan",
        "runId": "tf-sec-baseline-scan-1",
        "state": "failed"
      },
      {
        "platform": "001-workout-receipt",
        "runId": "tf-tc001-workout-receipt-1",
        "state": "blocked"
      },
      {
        "platform": "004-wellness-checkin",
        "runId": "tf-tc004-wellness-checkin-1",
        "state": "blocked"
      },
      {
        "platform": "007-pain-safety",
        "runId": "tf-tc007-pain-safety-1",
        "state": "blocked"
      },
      {
        "platform": "onboarding",
        "runId": "tf-web-onboarding-1",
        "state": "passed"
      },
      {
        "platform": "today-a11y",
        "runId": "tf-web-today-a11y-1",
        "state": "passed"
      },
      {
        "platform": "today-vision",
        "runId": "tf-web-today-vision-1",
        "state": "passed"
      },
      {
        "platform": "workout-day",
        "runId": "tf-web-workout-day-1",
        "state": "passed"
      }
    ]
  },
  "remoteVerification": {
    "remoteUrl": "https://github.com/mrodgersjs-web/ai-user-testing-mcp.git",
    "remoteMain": "d122149d41d34de71617ec1f672c189c8b757302",
    "localHead": "d122149d41d34de71617ec1f672c189c8b757302",
    "equal": true,
    "privateVerified": true
  },
  "sealedAt": "2026-08-30T23:46:42.793Z",
  "sealedBy": "ai-user-testing-verifier",
  "proofHash": "5ac054d0c6cab6e48059f11c2187d56e59f96bc676857a32eded7a297fc38e8c"
}
